day,topic,telugu,pronunciation,english,sort_order
24,Learning Telugu phrases,తెలుగులో ఎలా చెప్తారు?,Telugu-lo ela cheptaru?,How do you say it in Telugu?,4
24,Learning Telugu phrases,నేను సరిగ్గానే చెప్పానా?,Nenu sariggane cheppanaa?,Did I say it right?,5
24,Learning Telugu phrases,దయచేసి నన్ను సరిదిద్దండి,Dayachesi nannu sarididdandi,Please correct me,6
24,Learning Telugu phrases,అది రాయండి,Adi raayandi,Write it down,7
24,Learning Telugu phrases,దీని అర్థం ఏమిటి?,Deeni artham emiti?,What does this mean?,8
24,Learning Telugu phrases,నాకు కొంచెం అర్థమవుతుంది,Naaku konchem arthamavutundi,I understand a little bit,9
24,Learning Telugu phrases,తెలుగులో మాట్లాడండి,Telugu-lo matladandi,Speak in Telugu,10
25,Small talk,ఈరోజు వాతావరణం బాగుంది కదా?,Eeroju vaathavaranam bagundi kadaa?,"Nice weather today, right?",1
25,Small talk,నిన్న మ్యాచ్ చూశారా?,Ninna match choosara?,Did you watch the match?,2
25,Small talk,వీకెండ్ కి ఏమైనా ప్లాన్స్ ఉన్నాయా?,Weekend ki emaina plans unnayaa?,Any weekend plans?,3
25,Small talk,పని ఎలా జరుగుతోంది?,Pani ela jarugutondi?,How is the work going?,4
25,Small talk,కొత్త సంగతులు ఏంటి?,Kotha sangatulu enti?,What's new?,5
25,Small talk,పెద్దగా ఏమీ లేదు,Peddaga emee ledu,Nothing special,6
25,Small talk,దాని గురించి నేను విన్నాను,Daani gurinchi nenu vinnanu,I heard about it,7
25,Small talk,నిజంగానా?,Nijanganaa?,Really?,8
25,Small talk,అది ఆసక్తికరంగా ఉంది,Adi aasaktikaranga undi,That's interesting,9
25,Small talk,జాగ్రత్త,Jaagratta,Take care,10
26,City conversations,ఇది ఏ ఊరు?,Idi ae ooru?,Which city is this?,1
26,City conversations,హైదరాబాద్ చాలా అందమైన నగరం,Hyderabad chala andamaina nagaram,Hyderabad is a beautiful city,2
26,City conversations,మార్కెట్ ఎక్కడ ఉంది?,Market ekkada undi?,Where is the market?,3
26,City conversations,ఈరోజు ట్రాఫిక్ ఎక్కువగా ఉంది,Eeroju traffic ekkuvaga undi,Traffic is heavy today,4
26,City conversations,దగ్గరలో ఏటీఎం ఉందా?,Daggaralo ATM undaa?,Is there an ATM nearby?,5
26,City conversations,మంచి హోటల్ ఎక్కడ దొరుకుతుంది?,Manchi hotel ekkada dorukutundi?,Where can I find a good hotel?,6
26,City conversations,రాత్రిపూట సురక్షితమేనా?,Ratripoota surakshitamenaa?,Is it safe at night?,7
26,City conversations,ఇక్కడ ప్రసిద్ధ ప్రదేశాలు ఏవి?,Ikkada prasidda pradeshalu aevi?,What are the famous places here?,8
26,City conversations,రోడ్లు శుభ్రంగా ఉన్నాయి,Roadlu shubhranga unnayi,The roads are clean,9
26,City conversations,నాకు ఈ నగరం అంటే ఇష్టం,Naaku ee nagaram ante ishtam,I love this city,10
27,Asking for help,నాకు సహాయం చేయండి,Naaku sahayam cheyandi,Help me,1
27,Asking for help,ఎవరైనా నాకు సాయం చేస్తారా?,Evaraina naaku saayam chestara?,Can anyone help me?,2
27,Asking for help,నా బ్యాగ్ పోయింది,Naa bag poyindi,I lost my bag,3
27,Asking for help,దయచేసి పోలీసులకి కాల్ చేయండి,Dayachesi police-ulaki call cheyandi,Please call the police,4
27,Asking for help,పోలీస్ స్టేషన్ ఎక్కడ ఉంది?,Police station ekkada undi?,Where is the police station?,5
27,Asking for help,నాకు ఒక సమస్య ఉంది,Naaku oka samasya undi,I have a problem,6
27,Asking for help,నేను మీ ఫోన్ వాడుకోవచ్చా?,Nenu mee phone vaadukovachaa?,Can I use your phone?,7
27,Asking for help,నా డబ్బులు పోయాయి,Naa dabbulu poyayi,I lost my money,8
27,Asking for help,ఇతను మీకు తెలుసా?,Itanu meeku telusaa?,Do you know him?,9
27,Asking for help,దయచేసి నాతో ఉండండి,Dayachesi naatho undandi,Please stay with me,10
28,Understanding fast speech,మీరు ఏమన్నారు?,Meeru emannaru?,What did you say?,1
28,Understanding fast speech,నాకు అది సరిగ్గా అర్థం కాలేదు,Naaku adi sarigga artham kaaledu,I didn't catch that,2
28,Understanding fast speech,మళ్ళీ చెప్పండి,Malli cheppandi,Say it again,3
28,Understanding fast speech,మీకు అర్థమైందా?,Meeku arthamayindaa?,Did you get it?,4
28,Understanding fast speech,"అవును, నాకు అర్థమైంది","Avunu, naaku arthamayindi","Yes, I understand",5
28,Understanding fast speech,"లేదు, నాకు అర్థం కాలేదు","Ledu, naaku artham kaledu","No, I don't understand",6
28,Understanding fast speech,మీరు నాతోనే మాట్లాడుతున్నారా?,Meeru naathone matladutunnara?,Are you talking to me?,7
28,Understanding fast speech,నా మాట వినండి,Naa maata vinandi,Listen to me,8
28,Understanding fast speech,కొంచెం గట్టిగా మాట్లాడండి,Konchem gattiga matladandi,Speak a bit louder,9
28,Understanding fast speech,మీ ఉద్దేశ్యం ఏంటి?,Mee uddhesyam enti?,What do you mean?,10
29,Conversation practice,మనం తెలుగు ప్రాక్టీస్ చేద్దాం,Manam Telugu practice cheddaam,Let's practice Telugu,1
29,Conversation practice,నన్ను ఒక ప్రశ్న అడగండి,Nannu oka prashna adagandi,Ask me a question,2
29,Conversation practice,ఈరోజు ఎలా గడిచింది?,Eeroju ela gadichindi?,How was your day?,3
29,Conversation practice,బాగానే గడిచింది,Bagane gadichindi,It was good,4
29,Conversation practice,నాకు ఒక కథ చెప్పండి,Naaku oka katha cheppandi,Tell me a story,5
29,Conversation practice,మీకు ఇష్టమైన పనులు ఏంటి?,Meeku ishtamaina panulu enti?,What are your hobbies?,6
29,Conversation practice,నాకు సినిమాలు చూడటం ఇష్టం,Naaku cinemalu chudatam ishtam,I like watching movies,7
29,Conversation practice,మీరు ఎలాంటి పాటలు వింటారు?,Meeru elanti paatalu vintaru?,What music do you listen to?,8
29,Conversation practice,ఈరోజు మీరు ఎక్కడికి వెళ్లారు?,Eeroju meeru ekkadiki vellaru?,Where did you go today?,9
29,Conversation practice,నేను పార్కుకి వెళ్ళాను,Nenu park-ki vellanu,I went to the park,10
30,Real life conversations,ఈరోజు చాలా బాగా చేశారు!,Eeroju chala baaga chesaru!,Good job today!,1
30,Real life conversations,మనం కోర్సు పూర్తి చేసాము,Manam course poorthi chesamu,We have finished the course,2
30,Real life conversations,తెలుగులో మాట్లాడుతూ ఉండండి,Telugu-lo matladutu undandi,Keep speaking Telugu,3
30,Real life conversations,తప్పులు చేయడానికి భయపడకండి,Thappulu cheyadaniki bhayapadakandi,Don't be afraid to make mistakes,4
30,Real life conversations,మీరు మెరుగుపడుతున్నారు,Meeru merugupadutunnaru,You are improving,5
30,Real life conversations,నేర్చుకోవడానికి సమయం పడుతుంది,Nerchukovadaniki samayam padutundi,It takes time to learn,6
30,Real life conversations,ప్రతిరోజూ సాధన చేయండి,Pratiroju saadhana cheyandi,Practice every day,7
30,Real life conversations,స్థానిక ప్రజలతో మాట్లాడండి,Sthaanika prajalatho matladandi,Talk to local people,8
30,Real life conversations,నిన్ను చూస్తుంటే నాకు గర్వంగా ఉంది,Ninnu chustunte naaku garvanga undi,I am proud of you,9
30,Real life conversations,ధన్యవాదాలు మరియు వీడ్కోలు,Dhanyavadalu mariyu veedkolu,Thank you and goodbye,10